archived,author,author_flair_css_class,author_flair_text,body,controversiality,created_utc,distinguished,downs,edited,gilded,id,link_id,name,parent_id,removal_reason,retrieved_on,score,score_hidden,subreddit,subreddit_id,ups
True,fadgearse,,,The most shocking thing about all of this - is how June Sarpong has somehow managed to get a gig on US TV - she needs a vaccine.,0,1262370101,,0,False,0,c0i1yl3,t3_akhtm,t1_c0i1yl3,t3_akhtm,,1426171975,2,False,politics,t5_2cneq,2
True,jmtramel,,,"It's not just the ""religious"" right; there are also the conservatives that deny science/climate/vaccinations/911 and have equally stupid ideas. 

It's a worthless cause, trying to take a term that everyone accepts for a meaning and convince them that it's inaccurate.  If that were the case, then ""libertarian"" would only be ascribed to socialist anarchists.  Terminology changes with time; ""conservative"" is relative, and right now this is what it is.  Take it or leave it.",0,1262400713,,0,False,0,c0i2lfl,t3_aklvl,t1_c0i2lfl,t3_aklvl,,1426172271,1,False,politics,t5_2cneq,1
True,NoMoreNicksLeft,,,"This doesn't sum up the opposition in any way, shape, or form.

I am opposed to any of the proposed ""progressive"" reforms (be it single payer, the public option, or the mess we're about to get) on many grounds.

As a nation, we can't afford it. Now, I know all the bad math and handwaving that goes on... but it's flawed. And even if it weren't, it conflates the sum total of what individuals are paying now, and what the revenue of the nation is. The two are not the same.

I am opposed even if we can afford it, because adults are supposed to take care of themselves, and this is a good thing. It's not something they can do when it's easy, but then go whining to government when it is difficult... if you only do adult things when it is easy, you are not an adult. The lack of personal responsibility this would cultivate is sickening.

If you designed your ""systems"" so that it would still be possible for me to do as I wish, that would be one thing. But you threaten to take another slice of my paycheck for this, and on top of that some of the proposals would make it impossible to find any qualified health care workers whom I could pay for care. They'd all be government employees, directly or indirectly. I can barely afford my care as is, I can't be flying my kid to India to get her vaccinations.

Additionally, you're setting people up to be even more dependent on the state. What happens if or when things really fall apart? They'll be even more incapable.

Finally, the problem is insurance. You can't fix it by creating even bigger (government) insurance, changing insurance, or adding to it. You don't even understand the problem. In a nation where no one had insurance (either because they chose not to pay the premiums, or it was disallowed) medical prices would be orders of magnitude cheaper. Coupled with the supposedly many thousands per year that people pay for premiums, that would make it possible for everyone to care for themselves.",0,1262409677,,0,False,0,c0i2scg,t3_akmiy,t1_c0i2scg,t1_c0i2j5d,,1426172360,-10,False,politics,t5_2cneq,-10
True,NoMoreNicksLeft,,,"&gt; Would you support turning health insurance companies into non profits?

It's not about the profit. Anyone that sees their profit would be a fool to think that this will change things... 6% tops? Would you be ok if your bills were lowered by 6%, your premiums? Would just a few thousand fewer claim denials be enough for you to be ok?

I mean, if you want to turn them into non-profits, it doesn't bother me. Go ahead. I don't want insurance, and I choose to go without it. As long as you don't force me to buy it, I don't give a shit. But that's the rub, isn't it? You won't let me.

&gt; What if you're just starting out at your job and you get an expensive illness like cancer?

Then I die. This is going to happen no matter what, I understand this and accept it. But however much I have left, I'd like to live my life as independently and responsibly as possible.

&gt; That's why we have insurance.

No, you don't even know why you have insurance. You have it because everyone else has it and they mindlessly harp on you that you need it if you ever consider that maybe you don't. You let their nagging terrorize you, and then, quite after the fact, you rationalize it... as you do about many parts of the status quo (all of them, in fact, that don't happen to be unfashionable among your clique/subculture).

If you wanted to spread risk sensibly, you and all your extended family would be saving every red cent you got, no insurance, and pooling your money among each other. 4-6 earners who would otherwise be spending $12,000 per year on premiums would have a pool well above $1million. And the only people who could deny the claim would be those who love you the most, instead of strangers.

&gt; It's the definition of insurance.

Actually, insurance pays for expensive, unlikely things. If you're going by the definition, why the fuck are you retards using it for doctor's visits and routine things? Why vaccinations for your children and so forth?

You don't even understand the problem, yet you insist you know what the solution is... and your proof should anyone ask for it is ""because everyone else agrees with me"".",0,1262414503,,0,False,0,c0i2w25,t3_akmiy,t1_c0i2w25,t1_c0i2ujq,,1426172408,-9,False,politics,t5_2cneq,-9
True,sockpuppetzero,,,"So,  how do we organize?   What's the *raison d'être* for a social movement that Matt Taibbi spoke of?   Part of the problem with organizing the left is that we tend to bring too many issues to the table,  and that inevitable disagreements tend to cause division and diffusion instead of spirited debate and further collaboration.

A few comments of the way I see the world:

1.  Science:   *real* science should be a core value of any given movement.   Unfortunately you have a lot of anti-vax and self-styled environmental idiots running around proclaiming themselves liberal leaders. 

2.  Environmentalism:    I care very much about the environment.   Unfortunately,  environmentalism has a deserved and undeserved reputation for being the movement of ""no"".  More disturbingly,  I see a close-mindedness and anti-intellectualism,  often discarding science in order to tow the ""party line"".   Taking a reasonably complete account of the benefits and risks of any given technology is generally not done.   

    A. support for nuclear power:   the specific power density of nukes and the specific energy of nuclear fuels is phenomenal.   The mining footprint is relatively small and the technology has a rather unique advantage of leaving almost all of the pollution in one place.    Due to thermodynamics,  breeder reactors are a must;  fast plutonium breeders have some messy safety issues,   thermal u-233 breeders (i.e. thorium) seem much more realistic. 

   B. Proper accounting for biofuels:   In the long run,  I'm optimistic about the possibilities for biofuels.    However,  I think our current efforts are profoundly misguided,  causing rainforest destruction and food insecurity due to increased demand for grains.

   C.  Wind and solar are considered by many environmentalists the only two ""acceptable"" technologies,  which is misguided.    They are ok,  but it's not all puppies and babies.   Wind in particular requires a lot of concrete and steel, and has low power densities.   Solar has the potential for lower capital costs,  but the power densities are still rather low.    More to the point,  while I believe they could provide half of our electrical needs,  it's completely unrealistic for them to be a complete energy solution.  

3.  Social sanity.    Let's take back the words ""socialism"" and ""liberal"",  and offer a unified front against xenophobia and homophobia.  Racism and sexism aren't exactly solved problems,  but they aren't primary issues anymore.  

4.   Electoral reform:   Condorcet voting or approval voting FTW!   Instant runoff and plurality voting FTL!  

5.   Educational reform:   We need to repeal NCLB,  and we need a new new math effort based around statistics and computer science and de-emphasizing calculus.

That said,  we shouldn't put down the netroots as a movement too much.   Part of the problem is that much of the ""action"" happens online,  and doesn't get more widespread recognition,  except to lambaste and demonize it.   The question really is,  how do we focus our message,  to amplify it,  and to turn it into action IRL?",0,1262517665,,0,True,0,c0i4tg1,t3_akyt0,t1_c0i4tg1,t3_akyt0,,1426173309,4,False,politics,t5_2cneq,4
True,bvanmidd,,,"&gt;Chances have nothing to do with it. Security/precautionary measures are always 100% compared to a much lesser chance of something bad happening. We get shots so that we won't get a rare disease. We wear seatbelts every time we drive because there's a slight chance that that one particular drive will be the one in a million time that we get into an accident. ""It doesn't happen very often"" isn't any reason not to prevent against it. I don't know about you, but I've been taught ways to avoid getting struck by lightning.

Forgive my outburst, but

***AAAAAAHHHHHHHH***

It's called risk management. We don't just do everything because it might prevent something bad. We look at the costs.

Cars crash frequently enough that it is expected for each individual in America to experience at least 1 car crash in their lifetimes. It isn't 1 in a million. The cost to include a seatbelt in every vehicle in America is nominal to the costs in property and personal injury damage.

Shots, or rather vaccines, are effective in stopping viruses. They are our only protection against them. Here, it is a matter of doing something, or catching rubella. The cost of the vaccine is small in comparison to getting the measles.

To be an efficient use of tax dollars, scanners need to significantly reduce the occurrences of bombs blowing up planes and killing people. Whether that's enough to cover the cost of the machine, or half that cost, is up to the decision makers.

Given that the chances of plane bombings are so low, there is NO prediction for the scanners to prevent bombings. There is no prediction to preventing the next 9/11. I predict they will be costly and ineffective.",0,1262539326,,0,False,0,c0i546e,t3_al1sf,t1_c0i546e,t1_c0i50l8,,1426173447,3,False,politics,t5_2cneq,3
True,Aerik,,,"from Mercola, who thinks vaccines cause autism, and that homeopathy works.  You might as well be listening to deepak chopra.",0,1262585151,,0,False,0,c0i6dgf,t3_95sp8,t1_c0i6dgf,t3_95sp8,,1426174050,-1,False,politics,t5_2cneq,-1
True,[deleted],,,"Its incredibly scary to me how many educated liberal adults actually believe vaccines cause autism. It makes me insane, its as bad as arguing with creationists. 

Jenny McCarthy should be sued for selling snake oil, or something. ",0,1262598692,,0,False,0,c0i6m7o,t3_al68h,t1_c0i6m7o,t1_c0i6j5g,,1426174162,7,False,politics,t5_2cneq,7
True,[deleted],,,"While I'm sure that there have been abuses, this sounds like bad chemistry and more anti-science from the same kind of people who'll tell you silver fillings will give you mercury poisoning, vaccines will give you autism, and fluoride in your water will kill you.

",0,1262640951,,0,False,0,c0i7hkl,t3_alen0,t1_c0i7hkl,t3_alen0,,1426174569,3,False,politics,t5_2cneq,3
True,kgonzal,,,"I really don't feel that this is any different than countries having certain medical requirements for their visitors (vaccinations, chest x-rays, etc.) or the US inquiring if you've been in contact with any livestock upon re-entering (they screen you differently if you have). Certain countries contain certain risks and if you want to travel, you have to accommodate for safety measures. If you have nothing to hide, it shouldn't be a big issue. ",0,1262739643,,0,False,0,c0i9vfi,t3_alwdr,t1_c0i9vfi,t3_alwdr,,1426175697,1,False,politics,t5_2cneq,1
True,REdd06,,,"Harry Truman, Doris Day, Red China, Johnnie Ray
South Pacific, Walter Winchell, Joe DiMaggio

Joe McCarthy, Richard Nixon, Studebaker, television
North Korea, South Korea, Marilyn Monroe

Rosenbergs, H-Bomb, Sugar Ray, Panmunjom
Brando, ""The King and I"", and ""The Catcher in the Rye""

Eisenhower, vaccine, England's got a new queen
Marciano, Liberace, Santayana goodbye",0,1262880833,,0,False,0,c0id37b,t3_amoba,t1_c0id37b,t1_c0id0u6,,1426177213,33,False,politics,t5_2cneq,33
True,[deleted],,,"Keep in mind when reading this that the CS Monitor is a publication of Christian Science, a religion which urges its practitioners to avoid medicine of all kinds.  This includes vaccines (and I'm not talking about H1N1, I'm talking about polio, rubella, mumps -- things that regular people in developed countries don't have but which kill almost exclusively Christian Science children), antibiotics, and professional medical help for difficult childbirths, which is why there are about 30 Christian Scientists left in the entire world and why their reading rooms are always closed.

So my thoughts are: crazy as shit, would love to institute their weird Clockwork Orange policies (what are they, going to force us to keep our eyes open?) but lack the manpower, the money, the political will, and the intelligence to do so.",0,1262929352,,0,False,0,c0iepyb,t3_an065,t1_c0iepyb,t3_an065,,1426177974,1,False,politics,t5_2cneq,1
True,[deleted],,,"I agree with you that the reconstruction of Iraq has been an abysmal failure, and Halliburton sucks ass. It wasn't a well thought out war, but i believe it was a well intentioned one. 

I don't think the plan was to bomb the hell out of a country, botch it's reconstruction, cost the government a trillion dollars, and make some giant corportations a bunch of money. I don't think this was some elaborate plan put together by the Bush family to consolidate power. I mean he was an idiot. [Just look at him](http://www.needlenose.com/i/swopa/BushIdiot2.jpg) I think we we're genuinely here to right a wrong, and we didn't do it as well as we should have because our president was a retard.

The video seemed to lay it on pretty thick. Yep, the US is totally at fault for hitting utilities during bombing runs. But really, no gauss in your hospital? That seems like a stretch to me. Also, depleted uranium (Saddam's fault) is not the 1 cause of gulf war syndrome. It's more closely associated with the sarin gas Saddam was stockpiling is more closely associated with gulf war syndrome, as well as the anthrax vaccines needed by US troops in case of an anthrax attack by Saddam.  I believe her that it sucks to be an Iraqi right now. But the blame for that needs to fall on Saddam's shoulders, and not just on America. 

I just get annoyed by people blaming America for trying to help when no one else is doing a damn thing. If we're not doing it right, someone show us how it is done,
",0,1262954168,,0,False,0,c0if380,t3_amxni,t1_c0if380,t1_c0if1rf,,1426178146,1,False,politics,t5_2cneq,1
True,[deleted],,,"i guess, and hey whatever im never getting a vaccine for it, but i still know a couple of people, one of whom was hospitalized for quite a while (a twenty-something, otherwise healthy male). 

i never felt threatened (despite living in new york, and, at the time, working a few blocks from one of the schools that had a big outbreak) but it's not like they just made it up or something.",0,1263310302,,0,False,0,c0imyyq,t3_aonng,t1_c0imyyq,t3_aonng,,1426181948,10,False,politics,t5_2cneq,10
True,Jigsus,,,Whatever I'm still getting vaccinated.,0,1263310843,,0,False,0,c0imzfm,t3_aonng,t1_c0imzfm,t3_aonng,,1426181950,10,False,politics,t5_2cneq,10
True,[deleted],,,"Somehow, 
I'm not surprised. I didn't get a vaccination, because after putting 2 and 2 together, I realized it was NOT serious, and I was not at risk.

On the other hand, I suspected this from the beginning, and it irks me that pharmaceutical companies pushed for mass vaccination.

Who's to say that H1N1 wasn't also created in a laboratory?

They'll just be infecting us with something more serious next time.

*Slaps on tinfoil-hat!*",0,1263310903,,0,False,0,c0imzhd,t3_aonng,t1_c0imzhd,t3_aonng,,1426181950,-3,False,politics,t5_2cneq,-3
True,ooermissus,,,Wolfgang Wodarg was last heard from claiming that the flu vaccine might [cause](http://genome.fieldofscience.com/2009_09_01_archive.html) cancer.,0,1263310991,,0,False,0,c0imzk0,t3_aonng,t1_c0imzk0,t3_aonng,,1426181952,45,False,politics,t5_2cneq,45
True,[deleted],,,"Yes! I made a post asking about who was choosing to not get vaccinated, and I was quickly down-voted into oblivion.",0,1263310994,,0,False,0,c0imzk4,t3_aonng,t1_c0imzk4,t1_c0imz6k,,1426181952,6,False,politics,t5_2cneq,6
True,akula,,,"Healthy people get hospitalized with the flu every single year. The difference this year is that they named the flu strain publicly, hyped the flu, created a scare with their named flu and created a new vaccine for this deadly flu. So the scare worked on many as they flocked to hospitals at the first sign of the sniffles when normally they would just ignore. The flu numbers were artificially inflated and still didnt hit numbers to impress. Anybody that got any flu called it the swine flu. The CDC never really had people tested other then the select ""danger"" group. Diagnosis of H1N1 was mainly left to symptom diagnosis. And whats the symptoms of H1N1? Flu like symptoms of course....because its the damn flu. ",0,1263311033,,0,False,0,c0imzlp,t3_aonng,t1_c0imzlp,t1_c0imyyq,,1426181952,0,False,politics,t5_2cneq,0
True,webauteur,,,"Let's use an Internet meme to summarize this article:

1. Pressure the World Health Organization (WHO) to declare a pandemic

2. Develop a vaccine

3. ????

4. PROFIT!!!",0,1263311881,,0,False,0,c0in0dz,t3_aonng,t1_c0in0dz,t3_aonng,,1426181964,5,False,politics,t5_2cneq,5
True,[deleted],,,"I've been accused, on reddit and elsewhere, of actively wanting to kill off as many pregnant women as possible, due to my decision not to get this stupid unnecessary vaccine. Well, I'm exaggerating of course, but lots of impressionable twentysomethings on Reddit sure were a little too engrossed by the concept of ""herd immunity"" they recently discovered from Wikipedia and were very angry whenever someone questioned ""The Vaccine"".",0,1263312354,,0,False,0,c0in0ut,t3_aonng,t1_c0in0ut,t1_c0imz6k,,1426181969,-2,False,politics,t5_2cneq,-2
True,flynnguy,,,"I don't think anyone is saying they made up the swine flu, just that it was completely over hyped. Like everyone who didn't get the vaccine was going to die. 

I know a couple of people who probably had it (not sure if strain was tested) and they got sick but they certainly didn't die. ",0,1263313055,,0,False,0,c0in1la,t3_aonng,t1_c0in1la,t1_c0imyyq,,1426181978,3,False,politics,t5_2cneq,3
True,jasond33r,,,"If it is so profitable why have many drug companies stopped making the vaccine?  are we to believe that not ""Big Pharma"" but the few remaining drug companies producing flu vaccine are behind this conspiracy?  Wouldn't it make more sense for them to do like the rest and just not make the vaccine in place of more profitable drugs they could be making?  Just doesn't make sense.

&gt;The shortage is compounded because the number of companies producing vaccine has dropped significantly over the years because those companies could not makes a MUCH profit as they thought they should. The comapnies were profitably but not hugely profitable like they would be making other drugs. That is greed pure and simple.

[Source](http://www.oregonlive.com/health/index.ssf/2009/11/until_theres_more_swine_flu_va.html)


&gt;only one company now makes MMR vaccine, and only three make flu vaccine, with two of them controlling over 95% of the market.

[Source](http://www.medicalprogresstoday.com/news/news_indarchive.php?id=336)

",0,1263313137,,0,False,0,c0in1ol,t3_aonng,t1_c0in1ol,t3_aonng,,1426181982,4,False,politics,t5_2cneq,4
True,spamdefender,,,"Some people don't enjoy getting sick for a week and missing work.  The vaccine saves them from this major inconvenience.  With most Americans living paycheck to paycheck, it is a small investment that could end up saving you money and time in the long run.  No one is hysterical saying ""OMG I'm gonna die"".  ",0,1263313199,,0,False,0,c0in1r7,t3_aonng,t1_c0in1r7,t1_c0in0r4,,1426181982,6,False,politics,t5_2cneq,6
True,MrDorkESQ,,,"I 100% know that the vaccine is safe.  My sister helped develop it and I don't think she wants to kill anyone, at least not with a vaccine.  She'd probably use her heat vision or something like that.",0,1263313596,,0,False,0,c0in262,t3_aonng,t1_c0in262,t1_c0in1j0,,1426181987,2,False,politics,t5_2cneq,2
True,aecarol,,,"And if N1H1 had turned out to be really bad the same people would be shrieking out ""unprepared"" the Government was.

Y2K turned out to not be so bad BECAUSE billions were spent in advance to fix the worst of the problems.  Had it not been done, there would have been anger about ""how obvious the danger was"" and how it was ignored.

Anti-vaccine people fume about having to get their kids shots, because ""measles is so rare"".  It's ""rare"" because PEOPLE GET THEIR SHOTS.

It's not fair to complain about the bother of the work to mitigate a problem using the excuse the problem turned out mild.

(i.e. Why are we wasting so much money on levy/dike maintenance, the town hasn't flooded in years!)

When H1N1 was first found it was frightening because it spreads more easily than normal flu and it killed people that ""ordinary flu"" would not have.  It's also related to the flu strain that killed 30 MILLION people 90 years ago.

It turns out to not be quite as bad as feared and lots of people were vaccinated which acted as a firewall.",0,1263313712,,0,False,0,c0in2ar,t3_aonng,t1_c0in2ar,t3_aonng,,1426181987,36,False,politics,t5_2cneq,36
True,terrycarlin,,,"I've had the flu, its just flu. If I could go back in time and get vaccinated I just wouldn't bother. ",0,1263313920,,0,False,0,c0in2iq,t3_aonng,t1_c0in2iq,t1_c0imzfm,,1426181990,0,False,politics,t5_2cneq,0
True,Anthet,,,"I managed to contract the swine flu (along with a couple of people at my employer at the time). had some issues with breathing ok and felt like crap, went to the ol dr got the tamiflu was better within one day. Some people had it worse and some people never contracted it, a vaccine would have been nice to avoid being bored out of my mind in quarantine but no vaccine was available at the time. 
I seriously doubt it was a conspiracy, some people over hypted it but thats to be expected by the media, they sell more papers.",0,1263314037,,0,False,0,c0in2mk,t3_aonng,t1_c0in2mk,t3_aonng,,1426181991,8,False,politics,t5_2cneq,8
True,manganese,,,"Do you take any medication? Do you know what they are comprised of? I'm sure you've taken vaccinations before, did you object to those as well because you don't know what they are made of? You know what, we actually do know what makes a flu [vaccine](http://www.cdc.gov/Flu/protect/keyfacts.htm) is made of.",0,1263314254,,0,False,0,c0in2ts,t3_aonng,t1_c0in2ts,t1_c0in1j0,,1426181994,2,False,politics,t5_2cneq,2
True,noddyxoi,,,"You can add somewhere the following:

a) [Spread contaminated samples](http://www.bloomberg.com/apps/news?pid=newsarchive&amp;sid=aTo3LbhcA75I)

b) *In early May the WHO changed its definition of a pandemic. Before that date there had to be not only a disease which had broke out in several countries at once but also one that had very serious consequences with the number of deaths above the usual average. This aspect was removed from the new definition, to retain the rate of spread of disease as the only criteria. And they claimed that the virus was dangerous because people had not been able to develop immunity against it. [global research](http://www.globalresearch.ca/index.php?context=va&amp;aid=16902)*

c) Now note that the first flu case was registered in [April](http://en.wikipedia.org/wiki/2009_flu_pandemic) but:

*In January 2009 the United States Department of Health and Human Services awarded Novartis a $486 million contract for construction of the first U.S. plant to produce cell-based influenza vaccine, to be located in Holly Springs, North Carolina. The stated goal of this program is the capability of producing 150,000,000 doses of pandemic vaccine within six months of declaring a flu pandemic. [wikipedia](http://en.wikipedia.org/wiki/Novartis)*

[Terasa Focales can explain in more detail](http://www.youtube.com/view_play_list?p=13B456B8E5934C45&amp;search_query=nun+flu)",0,1263314537,,0,True,0,c0in34j,t3_aonng,t1_c0in34j,t1_c0in0dz,,1426181998,6,False,politics,t5_2cneq,6
True,cazbot,,,"That's pretty much my take on it too.  Get the vaccine if you haven't yet had the flu and want to avoid the cough and congestion, but don't worry about any serious symptoms.",0,1263314882,,0,False,0,c0in3ic,t3_aonng,t1_c0in3ic,t1_c0in2mk,,1426182003,2,False,politics,t5_2cneq,2
True,[deleted],,,"Actually, I got down voted when I said I was not going to get vaccinated. Maybe you lost your memory? 
AND I got jumped all over by redditors because I was not getting the shot.",0,1263314915,,0,False,0,c0in3jp,t3_aonng,t1_c0in3jp,t1_c0in0rc,,1426182004,8,False,politics,t5_2cneq,8
