archived,author,author_flair_css_class,author_flair_text,body,controversiality,created_utc,distinguished,downs,edited,gilded,id,link_id,name,parent_id,removal_reason,retrieved_on,score,score_hidden,subreddit,subreddit_id,ups
True,Biff_Bifferson,,,"&gt;Someone who challenges the theory of evolution in the 21st century is not thinking straight. Do you disagree on that point?

Of course not - but I'd say the same thing about anyone who finds Dane Cook funny. Again, it doesn't have anything to do with government. Evolution is a complicated theory and someone who's brought up to be religious has a lot of reasons to doubt it. No, I don't like the fact that someone's religious, but they may have other redeeming qualities. 

&gt;The fact that we are talking about whether she's a witch or not is absolutely ridiculous at this level of the game! Don't you think so?

The fact that we're talking about whether or not she's a witch is the fault of *liberals*, not O'Donnell. Democrats were trying to dig up dirt on her and they found some (if you can call dabbling in witchcraft as a teenager ""dirt"") and I think it's pretty shameful that the Democrats and the media are dredging it up. It's meaningless nonsense. 

&gt;wouldn't you rather that they spent their time talking about them instead of talking about witches and bearded marxists? 

Again, dabbling in witchcraft is a non-issue. The question of whether or not someone called themselves a Marxist, however, *is*. I doubt the validity of the claim, but it's a valid question.

&gt;When people are voting for candidates that can talk only in slogans and engage in petty demagoguery, when it is completely obvious there is absolutely nothing of substance there (I swear!) don't you think there should be some sense of outrage? 

Absolutely. If that's the case with a candidate, don't bother voting for them, since they aren't thinking for themselves. However, there is something to be said for voting in a so-called ""useful idiot"" who will vote the way you want because they were told to. It's not honorable and it's a contribution to the dumbing down of politics but I can understand the practicality of it. 

&gt;insulting them is counter productive. I agree 100%. What else do you do then?

I'm not saying O'Donnell has anything to offer - I don't know anything about the woman. If you think O'Donnell is a moron then don't vote for her. What I was talking about was the way you talk to *people*. Compassion and understanding for the human condition is a start. Religious people, those who don't believe in evolution, people who take homeopathic drugs, anti vaccination people, etc, are not stupid people. They're not bad people, either, and they may have intelligent opinions and theories on other matters. They've simply been tricked. When you resort to childish name calling and insults you only reinforce someone with an erroneous belief. I'm a fiscal conservative and a civil libertarian and when someone tells me that I only want low taxes and legalized drugs because I'm an evil rich-loving asshole who wants poor people to die in the streets it doesn't do anything to change my mind - all it does is reinforce my idea that the other side can't back up their ideas with facts and instead have to resort to emotion. We're all guilty of it at times, I'm not saying you're an asshole - everyone gets fed up, but what you need to understand is that the attitude you displayed in the OP is not helpful to anyone, especially not yourself. 

",0,1287188461,,0,False,0,c12fgew,t3_dr5rn,t1_c12fgew,t1_c12f6zg,,1426518282,1,False,politics,t5_2cneq,1
True,dillikibilli,,,"&gt;Religious people, those who don't believe in evolution, people who take homeopathic drugs, anti vaccination people, etc, are not stupid people. They're not bad people, either, and they may have intelligent opinions and theories on other matters.

I completely agree! But even the most intelligent people do and say stupid things sometimes, right? Why is it wrong to call a particular statement or act stupid? Is it wrong to call out the stupid in people but not call people stupid. If you were having a chat with someone and they said something stupid you would say ""hey, that's pretty stupid dude"". That doesn't mean they're stupid, it means that thing they said or did is pretty stupid! What's so wrong about that? Yes, I know, that's not what I did, I was pissed off and I ranted but I did say in the title of my post that ""if you vote for O'Donnell you're a dumb fuck"" - not you're just a dumb fuck in general, but if you do this particular thing, you're pretty dumb. How else can I say that? Would it be more appropriate if I'd said ""If you vote for O'Donnell you're pretty stupid""? Is it the cursing that is inappropriate or is it the fact that even expressing that opinion is inappropriate?

I hear you about losing my temper. I sort of exploded after the debate! I'll take your advice and try to keep it in check.",0,1287189915,,0,False,0,c12fils,t3_dr5rn,t1_c12fils,t1_c12fgew,,1426518311,1,False,politics,t5_2cneq,1
True,nepharis,,,"I'm much less concerned about his faux machismo than his anti-vaccination rant in there.  I can deal with most types of crazy, but I will never be able to stomach fear of proven, live-saving science.  In his position of media power, how many (more) people are now going to not get their kids flu vaccines?  How many of those kids are going to be terribly sick this winter?  How many are going to die?  (Influenza kills ~40k people per year in the USA; additionally flu is a primary cause of childhood pneumonia.)  Downright disgusting.",0,1287190165,,0,False,0,c12fizk,t3_drvdd,t1_c12fizk,t3_drvdd,,1426518316,1,False,politics,t5_2cneq,1
True,[deleted],,,"If I recall correctly, a lot of the whooping cough deaths in California have NOT been a result of parents failing to vaccinate their children, but more due to it taking a long time to diagnose.

[Source](http://articles.latimes.com/2010/sep/07/local/la-me-whooping-cough-20100907).",0,1287268818,,0,False,0,c12i398,t3_drgqh,t1_c12i398,t1_c12dri1,,1426519511,1,False,politics,t5_2cneq,1
True,veracitystew,,,It's hard to make out if his co-host is for or against flu vaccines. I'm still shaking my head at the ridiculous made-up scenario.,0,1287272163,,0,False,0,c12i846,t3_drt46,t1_c12i846,t1_c12ey2y,,1426519574,1,False,politics,t5_2cneq,1
True,sweetmonkeybush,,,"Among the idiotic questions I was asked in the three phone interviews when I applied for health insurance for my healthy newborn daughter were ""why do you want to purchase health insurance?"" and ""has the applicant ever been an inpatient at a drug or alcohol rehabilitation facility?"". The insurance industry needs to die in a fire.  

Edit: with the deductible, we have paid $770 + 6 months x $166/month = $1766 to have our daughter weighed, measured, and vaccinated.  ",0,1287291797,,0,True,0,c12iuyc,t3_ds8q3,t1_c12iuyc,t3_ds8q3,,1426519870,17,False,politics,t5_2cneq,17
True,powercow,,,"the dems just got rid of abstinese.

There isnt much screwing arround with schools except constantly keeping the creationists out.

before the 1900s you had to be rich to get your kids even a highschool education.

I happen to like the GPS system, weather sats, instate roads, the gov helping when a hurricane slams into your state(well not when the GOP is running things), the gov protecting my corp from foreign thievery and unfair trade, my grandmother being able to live out her life, not in pain, not worrying about doctor bills, not dying in poverty like a MAJORITY did before medicare.

I dont like the military going out on bullshit wars or how much we spend, but I do like HAVING a military.

we also have a much safer food supply and water supply than many other countries.

vaccines are unprofitable, and would be totally unavailable for the people who need it most, the poor and elderly without government assistance

this little thing reddit is on,, called the net, was publicly funded, cant say I dont use it on occasions.
",0,1287332256,,0,False,0,c12jwgc,t3_dsdqs,t1_c12jwgc,t1_c12jucw,,1426520357,4,False,politics,t5_2cneq,4
True,mrzack,,,don't take the vaccines.  ,0,1287513597,,0,False,0,c12rvsf,t3_dsyk5,t1_c12rvsf,t3_dsyk5,,1426524132,0,False,politics,t5_2cneq,0
True,ohgodohgodohgodohgod,,,"Do yourself a favor and correct the situation. Here are two that I like:

[The Last Question](http://www.multivax.com/last_question.html)

[The Last Answer](http://jasonjackson.com/weblog/2009/12/20/the-last-answer-by-isaac-asimov/)",0,1287530015,,0,False,0,c12sxw5,t3_dtbtw,t1_c12sxw5,t1_c12shq6,,1426524625,3,False,politics,t5_2cneq,3
True,[deleted],,,That plus the vaccines giving you alzheimer's comment make this whole thing a little too nutty to be taken seriously.,0,1287595639,,0,False,0,c12vomp,t3_dtvsd,t1_c12vomp,t1_c12vn79,,1426525922,9,False,politics,t5_2cneq,9
True,Ozdock,,,At least it's a positive agenda. I'd rather them push proven vaccinations on the general populous than push half the crap Fox does.,0,1287635292,,0,False,0,c12y14e,t3_du7gl,t1_c12y14e,t3_du7gl,,1426527016,9,False,politics,t5_2cneq,9
True,ghibmmm,,,"If the vaccines are proven, then why is 10% of this population here catching the disease after vaccination?  In fact, it states that he received the vaccine precisely 15 days before becoming ill.

No, that's a load of crap.  They're burying the idea that there's an immunosuppressive factor besides a lack of vaccination that's causing the disease.  That's why they're all Hispanic, because being Hispanic in the U.S. is correlated with poor living conditions.  CNN is using this as an excuse to hoist vaccination campaigns onto the U.S., which is a huge mistake.",0,1287635424,,0,False,0,c12y1cl,t3_du7gl,t1_c12y1cl,t1_c12y14e,,1426527020,-8,False,politics,t5_2cneq,-8
True,Ozdock,,,"Uh, no. You can't argue fact. Immunizations and vaccines, by design, work. It's been proven over and over again. I don't have to convince you, and seeing as how it's almost 1 in the morning, I'm not going to do your research and baby feed you information.

I don't know where exactly you're getting your information, but please just spend 5 minutes on google, there's more than enough scientific evidence to support vaccinations. You're only putting yourself, and potentially others at even more risk by denying such things.",0,1287635924,,0,False,0,c12y27p,t3_du7gl,t1_c12y27p,t1_c12y1cl,,1426527031,7,False,politics,t5_2cneq,7
True,ghibmmm,,,"Vaccines do not augment natural immune function, they actually harm it by introducing heavy metals into the body, which the immune system instinctively attacks.  The vaccines will thus cause tissue damage (most harmful in the brain) by inducing a live infection while suppressing the immune system.  There is critical epidemiological study on these points which has not barely been performed, or at least not performed honestly.  Something is most likely wrong with your diet, water or air if bacteria or viruses are taking over your body - something serious if an infection does not clear up quickly.  This is my first suspicion regarding the cases in this study - that the infants were malnourished, or fed formula instead of being breastfed, and so on.",0,1287636167,,0,True,0,c12y2nl,t3_du7gl,t1_c12y2nl,t1_c12y2hd,,1426527037,-4,False,politics,t5_2cneq,-4
True,Xenogyst,,,"I found a lot of those stories to have some fact problems.  A lot of them, at least, seem to overlook why an issue is or isn't important on the pure brightness of its hyped assertion.  Especially #11 on the list [about pharmaceuticals controlling the CDC and WHO in regards to H1N1](http://www.projectcensored.org/top-stories/articles/the-h1n1-swine-flu-pandemic-11-manipulating-data-to-enrich-drug-companies/) to be particularly bad journalism, if not outright a blatantly unsubstantiated ramble (for instance, it asserts that the vaccines were dangerous... just because).
",0,1287636224,,0,False,0,c12y2r5,t3_dtu50,t1_c12y2r5,t1_c12vs1p,,1426527038,1,False,politics,t5_2cneq,1
True,duckandcover,,,"Ummm, so your anti vaccine or what?  God, I hope your not that stupid.",0,1287636463,,0,False,0,c12y36g,t3_du7gl,t1_c12y36g,t3_du7gl,,1426527043,6,False,politics,t5_2cneq,6
True,ghibmmm,,,"Yes, I'm anti-vaccine.  Not out of ignorance, but out of diligent study.",0,1287636618,,0,True,0,c12y3gh,t3_du7gl,t1_c12y3gh,t1_c12y36g,,1426527047,-5,False,politics,t5_2cneq,-5
True,Ozdock,,,"Alright, your keeping me up now. 

""In 2001, however, a U.S. Food and Drug Administration study revealed that a 6-month-old receiving the recommended complement of childhood vaccinations was exposed to total levels of vaccine-based mercury twice as high as the amount the epa considers safe in a diet that includes fish. By the end of that year, thimerosal-free formulations of the five inoculations that included it—hepatitis B, diphtheria, tetanus and pertussis and some versions of Haemophilus influenzae type b (Hib)—had replaced the older versions. The result was a drop in mercury exposure in fully immunized 6-month-old babies from 187.5 micrograms to just trace amounts still found in some flu vaccines.""

""So, is there a link? In 2003, a 15-person committee impaneled by the CDC and the National Institutes of Health analyzed the available studies on thimerosal and its possible connections to autism and concluded that there was no scientific evidence to support the link. In a further show of confidence, the committee noted that it did ""not consider a significant investment in studies of the theoretical vaccine-autism connection to be useful."" Instead, the panel recommended that studies focus on less explored genetic or biological explanations for the disease.""

Read more: http://www.time.com/time/health/article/0,8599,1808438-2,00.html#ixzz12xvQMDCt",0,1287636619,,0,False,0,c12y3gl,t3_du7gl,t1_c12y3gl,t1_c12y2nl,,1426527047,6,False,politics,t5_2cneq,6
True,chiguy,,,"OK. So just don't get your kids vaccinated. Problem solved. 

&gt;inexplicably of the same race, which happens to be very poor in this country.

So because they're latino, you assume they're poor? In fact, I don't even see any indication on the infant's race, now that I investigate.

In fact, several of the reports I read say ""All the babies who have died this year were too young to be **fully** immunized""",0,1287643825,,0,False,0,c12ydpw,t3_du7gl,t1_c12ydpw,t1_c12ycue,,1426527250,5,False,politics,t5_2cneq,5
True,ghibmmm,,,"&gt; OK. So just don't get your kids vaccinated. Problem solved.

They then can't go to school.

&gt; In fact, several of the reports I read say ""All the babies who have died this year were too young to be fully immunized""

Sounds like you got lied to.",0,1287644270,,0,False,0,c12ye77,t3_du7gl,t1_c12ye77,t1_c12ydpw,,1426527252,-1,False,politics,t5_2cneq,-1
True,polyparadigm,,,"&gt;It's not so much that they want to control a woman's womb as they want to protect the developing child.

There's a suspiciously strong correlation between opposing abortion and non-fetus-related policies like opposing the use of condoms, opposing divorce, advocating that wives submit to husbands, disapproval of homosexuality, and opposing the warts/cervical cancer vaccine. In fact, these policies are often discussed together under the banner of ""family values."" They seem, to me, to be tied together only by a desire to control other people's bodies.

I don't even buy the argument that they are all supported by scripture.",0,1287644862,,0,False,0,c12yevt,t3_du3hx,t1_c12yevt,t1_c12x4jd,,1426527276,1,False,politics,t5_2cneq,1
True,ghibmmm,,,"&gt; At least you didn't try to defend your blatant lie that ""almost all of them are Hispanic infants""

Did you read the fourth link at all?  It's the one with the actual data:

&gt; Of the 9 deaths reported so far:

&gt;    * 8 were **Hispanic** infants

&gt;    * 8 were infants aged less than two months at the time of disease onset

&gt;    * None of the 8 infants **less than two months old** had received any doses of pertussis-containing vaccine

&gt;    * **1 was an ex-28 week premature baby who was 2 months old at the onset of the disease who had received the first dose of DTaP 15 days before becoming ill.** [emphasis added]
",0,1287648562,,0,False,0,c12yikl,t3_du7gl,t1_c12yikl,t1_c12yedz,,1426527323,-1,False,politics,t5_2cneq,-1
True,chiguy,,,"&gt;None of the 8 infants less than two months old had received any doses of pertussis-containing vaccine

OK so 8 of 9 had NO pertussis-containing vaccine. (how is 1 of 9 *some*?). So 8 of 9 didn't have the full vaccine, the one with the weakened virus. In fact, it could be said that they didn't even receive a vaccine at all

1 (not clear if included in the 8 already mentioned) had not received the full vaccination. 

Not to mention you own source says ""The best way to protect yourself form pertussis is to take the vaccination."" 

But yes, it's certainly curious that Hispanics are more susceptible to whooping cough. Like blacks and sickle cell.",0,1287649623,,0,False,0,c12yjhy,t3_du7gl,t1_c12yjhy,t1_c12yikl,,1426527335,4,False,politics,t5_2cneq,4
True,chiguy,,,"Ok, so 8 of 9 didn't have the full vaccine. What's your problem with it again?",0,1287650670,,0,False,0,c12ykcu,t3_du7gl,t1_c12ykcu,t1_c12yjqn,,1426527346,3,False,politics,t5_2cneq,3
True,ghibmmm,,,"http://www.whale.to/vaccines/smallpox.html

&gt; It is the great manufacturing firms who are providing the brains for the medical men of to-day.

 - Dr. Walter R. Hadwen, M.D., in 1925

&gt; Smallpox is considered one of the most virulent of contagious disaases, and it is generally believed that persons exposed are almost invariably attacked, unless protected by vaccination.  This is one of the most stupdenous exaggerations to be found in medical literature.  My experience has been that very few people take it when exposed to it.

 - John Tilden, M.D (1851-1940)",0,1287652937,,0,False,0,c12ym2a,t3_du7gl,t1_c12ym2a,t1_c12yls3,,1426527369,0,False,politics,t5_2cneq,0
True,Facehammer,,,"Which is why it was so very rare before the vaccine was discovered, I guess. Oh no, I don't mean rare, do I? I mean it was fucking everywhere. ",0,1287653311,,0,False,0,c12ymc5,t3_du7gl,t1_c12ymc5,t1_c12ym2a,,1426527373,3,False,politics,t5_2cneq,3
True,werak,,,"&gt; Like the right of self-defense, the private ownership of property is a God-given right that is rooted in the Sacred Text.

What the fuck. Is he trying to use the Christian bible to tell the government what rights he has, in a nation that is not to respect any specific religion?

&gt; Free men and women absolutely have the right to refuse vaccinations for themselves **and their children**.

Free children absolutely have the right to get vaccinated when their parents are morons.

Holy damn this guy is insane.",0,1287671036,,0,False,0,c12z5ak,t3_dudn4,t1_c12z5ak,t3_dudn4,,1426527633,1,False,politics,t5_2cneq,1
True,chiguy,,,"You have yet to prove either. Of course having a partial vaccination won't be as effective as a full vaccination. And you claimed that using the virus in the vaccine causes people to be infected by the virus, however 8 of these 9 weren't injected with the virus.",0,1287672375,,0,False,0,c12z80d,t3_du7gl,t1_c12z80d,t1_c12ykf1,,1426527669,1,False,politics,t5_2cneq,1
True,ghibmmm,,,"Everything after the phrase ""John Tilden, M.D. (1851-1940)"" in this thread is total shit.  Useless.  Stick to the science, and some things might actually be accomplished.

On that note, I've already linked you to this ancient (yet, miraculously, accurate!) article, ""SANITATION,  NOT VACCINATION THE TRUE Protection against Small-Pox"":

http://www.whale.to/vaccine/tebb1.html

It's no less true today than it was then.  Look at this quote:

&gt; Other writers confirm this testimony. The streets were mostly unpaved, with open gutters, cesspools under houses, stagnant ditches, polluted streams, tainted wells; and the air was contaminated with effluvia arising from the decaying bodies of the dead, interred in close proximity to living urban populations.

Something's changed in Western countries to decrease smallpox incidence, no doubt.  I'm willing to bet it's the elimination of, you know, dead bodies and sewage from open gutters in the street and water supplies, as opposed to injecting infants with live virus and heavy metals.",0,1287695196,,0,True,0,c130p9m,t3_du7gl,t1_c130p9m,t1_c12yp1z,,1426528360,0,False,politics,t5_2cneq,0
True,Wyatt22,,,"Poughkeepsie... you're on the air with Lady GA-guhh.  What's your question?

Turn your radio down, Poughkeepsie.

Oh, what a shame we can't hear from Poughkeepsie.  We'll have to move on.

Upper Poughkeepsie... you're on the air.  Do you have a political question for Lady GA-guhh or for our other guest, Dr. Jonus Salk, inventor of the Salk vaccine?",0,1287709241,,0,False,0,c131gum,t3_due6y,t1_c131gum,t1_c130hqp,,1426528717,2,False,politics,t5_2cneq,2
True,wackyvorlon,,,"HuffPo has always been bad. Just search the site for ""vaccine"". ",0,1287729797,,0,False,0,c132dtm,t3_durxn,t1_c132dtm,t3_durxn,,1426529144,2,False,politics,t5_2cneq,2
True,Facehammer,,,"&gt;Something's changed in Western countries to decrease smallpox incidence, no doubt.

At a wild guess, I'd say maybe it was the mass vaccination programs against smallpox? You are aware that the strain used for smallpox vaccination was harmless by comparison, right? And that it at no point contained heavy metals? ",0,1287731824,,0,False,0,c132g1k,t3_du7gl,t1_c132g1k,t1_c130p9m,,1426529173,3,False,politics,t5_2cneq,3
True,ghibmmm,,,"&gt; Something's changed in Western countries to decrease smallpox incidence, no doubt. I'm willing to bet it's the elimination of, you know, dead bodies and sewage from open gutters in the street and water supplies, as opposed to injecting infants with live virus and heavy metals.

That's a generalization about vaccines.",0,1287733912,,0,False,0,c132i4e,t3_du7gl,t1_c132i4e,t1_c132g1k,,1426529201,0,False,politics,t5_2cneq,0
True,ElectricRebel,,,"&gt;This is a form of ad hominem argument

Read your comments above. You did hate on industry: ""Technology is exploited by industry, which cares only about profit and market share. It doesn't give a crap about the human condition."" Regardless of if that statement is true or false, it certainly qualifies as ""hating on industry"".

As I said, I think that industry often gets out of line, but we need to work with industry to accomplish things.

&gt;This is a form of a false-choice argument. Everyone was NOT ""poor and extremely cruel by today's standards."" Likewise, with ""How come no social movements occurred to improve conditions back then?"" There have been social movements throughout history.

It is well documented that the vast majority of people had very shitty lives until very recently. Are you in denial of this?

Also, please name some successful social movements before the industrial revolution that wasn't based on one person's imaginary friend being better than another. Other than maybe a few brief periods during classical Greece (and certainly not in Sparta), I doubt you will find very much.

&gt;That originally was your basic premiss--take all the money from social services and put it into research. You characterized technology as ""the foundation of economic growth ... and social progress"" and ""a precondition"" for social progress.

Now you are mischaracterizing what I said. Social movements and social security are very different things.

&gt;What happens to the millions of people who rely on societal support while the researchers are working on solving technological problems? 

The question is hypothetical and is about opportunity costs. I posit that in the long term, increased R&amp;D funding does more good than spending it on social security. Yes, people will suffer in the short term, but people will be much better off in the long term.

&gt;More ad hominem.

No it is not. I stated an opinion that I think it is a shame that liberals don't focus more on R&amp;D. That is clearly an opinion, not an attempt to discredit an argument by attacking the person. You need to learn your fallacies better.

&gt;False characterization. I said that ""old issues may lessen only to be replaced by new problems"" in response to your statement ""Once we reach a certain degree of advancement, the issues you mentioned (energy, health care, environment) are moot."" The point was that there will always be new problems to solve.

Not a false characterization at all. You are just grasping at straw to be against my idea so you starting listing a bunch of things that aren't relevant at all. Besides, those problems could be also solved by R&amp;D.

You seem to be getting very angry simply because I believe that R&amp;D is more important than the welfare state. All of our modern comforts (i.e. the things the welfare state pays for) come from past technological advancements. For example, what use would universal healthcare be without penicillin and vaccines?

I encourage you to stop focusing on the ""fallacies"" you think I'm making and instead actually contemplate what my idea would do for society over the next 50 years.",0,1287753097,,0,False,0,c132xx5,t3_dubvr,t1_c132xx5,t1_c132won,,1426529419,1,False,politics,t5_2cneq,1
