archived,author,author_flair_css_class,author_flair_text,body,controversiality,created_utc,distinguished,downs,edited,gilded,id,link_id,name,parent_id,removal_reason,retrieved_on,score,score_hidden,subreddit,subreddit_id,ups
True,TheOneGaffer,,,"And if a child wanted to get an abortion without her mother knowing because of fear of physical reprisals, is that not also her right?  Because in the state of Washington, it is.

Parental ""rights"" are not absolute.  They are essentially custodial, and the state can take control of some of those rights, and pass on others to children if they so choose.  A child can drop out of school at 16, the state can compel parents to give their children vaccines, etc.  On the opposite side of the spectrum, parents can't just do whatever to their children (starve their kids, make them undergo non-medically necessary procedures, beat them, etc).

The fact is that abortion remains legal, and the ramifications of having a child is borne significantly more by the child than by the parent.

Moreover, by your own logic, that child has 'parental rights' over the fetus growing inside her, so I fail to see how that necessarily buttresses your point.",0,1269479871,,0,False,0,c0mube8,t3_bhs64,t1_c0mube8,t1_c0mu901,,1426253207,7,False,politics,t5_2cneq,7
True,rdiss,,,"Scientists apparently are not sure if my smallpox vaccination from godknowswhen would still protect me or not.  I hope so, but the best visualization I read was something like Britney Spears would die, but Eric Clapton would live.",0,1269547670,,0,False,0,c0mw6hw,t3_bi8zm,t1_c0mw6hw,t3_bi8zm,,1426254077,1,False,politics,t5_2cneq,1
True,[deleted],,,"There are thousands of pox viruses, smallpox is thought to have jumped from rodents to humans and stayed in the human population once our population density reached a specific threshold. Eventually monkey pox, mouse pox, gopher pox, or whatever will eventually jump to humans and we'll need another round of containment and vaccination. Unfortunately the new pox will likely have a host other than humans, meaning it can't ever be eradicated.",0,1269547903,,0,False,0,c0mw6w0,t3_bi8zm,t1_c0mw6w0,t3_bi8zm,,1426254082,1,False,politics,t5_2cneq,1
True,memefilter,,,"Goddamn you're gullible, Reddit.

You've no problem that Obama, the dems, Bush and the repubs all endorse killing a few million civilians elsewhere in the world.  Wooosh - in one ear and out the other.

You've no problem with the the Clinton Body Count, or the Bush Crime Syndicate's use of the CIA in domestic assassinations.

You've no problem with the FDA colluding with Big Pharma to label aspertame harmless, or pot a dangerous drug worthy of 20 years in jail, or the H1N1 vaccine being marketed to pregnant women who then miscarry in droves.

You've no problem with threats of political violence and retribution when it comes from Rove or Rahm, or when it's your state police terrorizing people at the behest of some DA or prosecutor.  No problem with the IRS auditing people to shut them up.  No problem with the FBI getting caught manufacturing terrorism.

You don't have a problem with *any* of that.

But as quick as you can say Tea Party it's all racist fringe psychopaths ready to explode into violence.  Without any *research* or *confirmation* that such events actually happened, unlike everything I listed above.

**THAT. IS. FUCKED. UP.**

You are being gamed *so hard*, and you're just too gullible to notice?  Fuck left vs right - how about trying informed vs ignorant, smart vs butt-fucking stupid?  You wonder why America is bankrupt and loathed by the world?  Do you think it might have *anything* to do with the fact that you're a bunch of easily manipulated children, whether left right or middle?

News Flash: there is *no such thing* as the Tea Party.  It's a label constructed to demonize the ~70% of this country that is affiliated with *neither* party.",0,1269612398,,0,True,0,c0mxveo,t3_bi7h8,t1_c0mxveo,t3_bi7h8,,1426254881,1,False,politics,t5_2cneq,1
True,seltaeb4,,,"washingtonpost.com 
Fixing Iraqi Health Care Comes at Expense of U.S. Needs, Critics Say 

By Ceci Connolly
Washington Post Staff Writer
Friday, October 17, 2003; Page A25 

President Bush and first lady Laura Bush have a vision for health care
in Iraq in which all mothers-to-be receive prenatal care, childhood
mortality rates plummet and every person has access to virtually free
treatment and medicine through an extensive network of 1,400 renovated
hospitals and clinics. 

It is a vision that will cost U.S. taxpayers almost $2 billion in the
first 18 months -- an amount some lawmakers say is too steep,
especially when a growing number of Americans cannot afford medical
care. 

""I certainly understand the need for health care in Iraq,"" said Sen.
Debbie Stabenow (D-Mich.), who tried unsuccessfully Tuesday to shift
$5 billion from Iraqi assistance to domestic education, health and
construction projects.

""This administration has a sense of urgency in Iraq that I don't see
here at home. We see hospitals closing and the number of uninsured
going up, and yet we don't see any sense of urgency from this
administration.""

The effort to revitalize Iraq's health care system is a source of
pride for the Bush administration in a postwar reconstruction program
that has often been hampered by violence, international squabbling and
logistical problems. Laura Bush has taken a personal interest,
lobbying for construction of a state-of-the-art children's hospital in
Basra that would one day draw patients and physicians from all over
the Middle East.

The Bush administration and many humanitarian relief groups say the
United States has a moral and legal obligation to rebuild Iraq.

""There is no doubt that the one responsible for this is, according to
the Geneva Conventions, the occupying power, and that is the U.S.-led
coalition,"" Morten Rostrup, international council president of the aid
group Doctors Without Borders, said recently.

Administration officials point to political and security imperatives
that make investment in Iraqi schools, hospitals, roads and housing
critical.

""If we are successful at rebuilding health care in Iraq, we can start
turning this terrible war against the terrorists,"" Health and Human
Services Secretary Tommy G. Thompson said in an interview. ""We can do
that better, I think, by using a doctor and medical diplomacy than we
can by other means.""

Winning the war on terrorism, Thompson suggested, requires doing
things that ""show the Muslim world we really do care about women and
children."" Medical intervention ""is one way we can highlight our
compassion.""

But as Congress conducts a fierce debate over the administration's
request for $87 billion to pay for operations in Iraq and Afghanistan,
the proposed medical program for Iraq illustrates the inherent
tensions in spending American dollars in a far-off land. At home, the
deficit is rising, unemployment hovers around 6 percent and many
voters complain to pollsters that Bush is not focused enough on their
economic plight.

""The same values that we hold for Iraq we must pledge for all
Americans,"" Rep. Rahm Emanuel (D-Ill.) said. ""The same goals we
envision for Iraq's future, we must envision for America.""

Emanuel and a contingent of liberal House members, in weekly floor
speeches dubbed ""Iraq Watch,"" have contrasted unmet domestic needs
with the ambitious plans for Iraq. The group cites a long list of what
it calls neglected domestic programs, such as veterans' health care,
schools, police on the street, prescription drugs for seniors and an
aging electric grid. 

""Restoring the Iraqi health system is a key part of the overall
reconstruction effort,"" said Sen. Edward M. Kennedy (Mass.), the top
Democrat on the Senate's health committee. ""But it is ironic that the
same administration that wants to improve health care in Iraq is so
indifferent to the exploding costs and declining coverage that are
undermining health care here at home.""

William Winkenwerder, assistant secretary for health at the Pentagon,
said better health care in Iraq will enhance stability in the entire
region -- and improving health appears to be one goal around which a
diverse collection of nations and nonprofit groups can unite.

""The health care piece is working, and it's working pretty darn well,""
said Winkenwerder, who added that he believes the medical successes
have not gotten the attention they deserve. ""This is one area where
the coalition has worked closely and effectively, and with a broad
international group.""

In the past 12 years, Iraq's health care system deteriorated from
being the jewel of the Middle East to Third World-quality care. In
2002, Iraq spent $16 million on health care for 25 million people,
Winkenwerder said, or about 65 cents per person. 

Infant mortality rates more than doubled, from 50 deaths per 1,000
born in 1990 to 107 per 1,000 in 2000. More than half the pregnant
women in the country are anemic, and about one-third deliver
low-birth-weight babies.

Emergency intervention and repairs have restored much of the system to
pre-war levels, Winkenwerder and Thompson said. Now they hope to make
Iraq's health system a regional leader once again.

Of the $87 billion the administration is requesting, $850 million
would be spent on health care in Iraq -- about $300 million for buying
generators and medical equipment, and the remainder for major
infrastructure work, according to the Office of Management and Budget.

Bechtel Corp. is the lead contractor on construction projects at
hospitals and clinics; other organizations such as Abt Associates and
UNICEF have received smaller contracts.

That $850 million would be in addition to $211 million spent on health
care from July through the end of this year and $946 million targeted
for health in the U.S.-installed occupation authority's budget for
2004, said James Haveman, the senior U.S. adviser to the Iraqi
Ministry of Health. 

Another $100 million for administration and salaries at the hospitals
and clinics has been drawn from seized assets of Saddam Hussein.

Some international aid experts have voiced skepticism about the
selection of Haveman, whose international experience is limited to
work with International Aid, a Christian relief organization. Ron
Waldman of Columbia University said the administration is focused too
heavily on bricks and mortar, rather than on fundamental public health
approaches such as teaching mothers to breast-feed, immunizing
children and extolling the virtues of hand-washing.

He and many others were sharply critical of the administration request
for $150 million to start work on a new, high-tech hospital in Basra,
a project about which sources said Laura Bush is particularly
enthusiastic.

""A facility designed to handle top-level pediatric care, plastic
surgery, burn treatment -- those aren't things that contribute to
infant or childhood mortality,"" he said. ""That's like building the
penthouse before the foundation.""

U.S. leaders are under ""tremendous pressure from the doctors and
public"" in Iraq to ""make symbolic improvements,"" said Richard
Garfield, a professor of clinical international nursing at Columbia
University, who spent the summer in Iraq advising the U.S. government
and international relief agencies. ""Hospitals are a black hole; you
can pour all the money you have into them and still not get the bang
for your buck.""

Thompson defended the project, saying, ""It's something to leave as a
legacy"" and could eventually draw patients from all over the Middle
East. House appropriators recently eliminated the Basra hospital and
shifted an extra $100 million to repairs of existing hospitals.

In a telephone interview from Baghdad, Haveman said 95 percent of the
$1.1 billion he controls is spent on direct medical services such as
nutrition counseling, vaccines, newborn screening, pharmaceuticals,
equipment, insect spraying, disease surveillance and training doctors
and nurses who have not heard about new Western techniques in more
than a decade.

Haveman nearly gushes over the level of U.S. support in Iraq. Yet he
realizes the United States cannot maintain those levels indefinitely.

Haveman and the Iraqis have done a needs assessment for health care.
Next week, at a donors conference in Madrid, he will ask the rest of
the world for $1.6 billion in aid through 2006.",0,1269671149,,0,False,0,c0mzsn2,t3_bit41,t1_c0mzsn2,t1_c0mzouj,,1426255779,24,False,politics,t5_2cneq,24
True,GreenDragonSage,,,"Well the cementing of your beliefs is due to the complexity of things I assume, DNA, etc. Again I'm just sayin, but complexity of DNA doesn't equal christian god...christianity has no more evidence that they understand the creator of the universe then any other religion...as far as politics goes, im not quite sure how you can advocate a religion that propogates the stoning of homosexuals and then be for gay rights. 

Religious moderation doesn't do anything...it's a refusal to take religion at face value in an attempt to still reap the benefits of modern science. Which again, is why people like Palin can stand  receive vaccinations for evolved diseases, and then say evolution isn't true. Trying to be religious and logical at the same time will get you nowhere fast. 

P.S. Mother Teresa proclaimed disbelief and a lack of faith towards the end of her life. If someone proclaiming disbelief in something signals to you a strengthening of that same thing, then there is no winning is there...discovering evidence of god and feeling like there is none all ends up in the same place, faith. In the end that is all there is to religion..no evidence, just faith and in the process people hate and exclude because of those beliefs. 

",0,1269794935,,0,False,0,c0n29fi,t3_bisch,t1_c0n29fi,t1_c0n1cc6,,1426256929,1,False,politics,t5_2cneq,1
True,BeerDrinkingRobot,,,"&gt;And the only insurance people have to buy is catastrophic, which only covers the cost for the hospital when they have a catastrophic event.

Sounds like a great idea, but the bill requires you to get a ""qualified plan"".  Check out [HR 4872 SEC. 122. ESSENTIAL BENEFITS PACKAGE DEFINED. ](http://frwebgate.access.gpo.gov/cgi-bin/getdoc.cgi?dbname=111_cong_bills&amp;docid=f:h4872rh.txt.pdf).  

&gt;Minimum Services to Be Covered- The items and services described in this subsection are the following:
(1) Hospitalization.
(2) Outpatient hospital and outpatient clinic services, including emergency department services.
(3) Professional services of physicians and other health professionals.
(4) Such services, equipment, and supplies incident to the services of a physician’s or a health professional’s delivery of care in institutional settings, physician offices, patients’ homes or place of residence, or other settings, as appropriate.
(5) Prescription drugs.
(6) Rehabilitative and habilitative services.
(7) Mental health and substance use disorder services.
(8) Preventive services, including those services recommended with a grade of A or B by the Task Force on Clinical Preventive Services and those vaccines recommended for use by the Director of the Centers for Disease Control and Prevention.
(9) Maternity care.
(10) Well baby and well child care and oral health, vision, and hearing services, equipment, and supplies at least for children under 21 years of age.
",0,1269863522,,0,False,0,c0n3xpm,t3_bjk02,t1_c0n3xpm,t1_c0n3v5y,,1426257713,7,False,politics,t5_2cneq,7
True,Facehammer,,,"Make no mistake, they exist. The anti-vaccination movement makes up a good chunk of them, along with similar batshittery like homeopathy and that sort of crap. 

A more specific example would be that Sea Shepherd guy. Awesome? Arguably. Crazy? Without a doubt. 

In today's society, even at their worst, left-wing nutters are usually not anywhere near as loud, numerous or dangerous as right-wing nutters. ",0,1269884712,,0,False,0,c0n4jum,t3_bjrwb,t1_c0n4jum,t1_c0n4glo,,1426258014,1,False,politics,t5_2cneq,1
True,IrishJoe,,,"Why do you think the anti-vaccination movement are liberal. Most I know vote Republican. And I know more than a few of them. They're convinced the government is out to get us and control their kids through vaccinations and fluoridated water. 

And I agree that no one who practices ""batshittery like homeopathy"" has been arrested for conspiracy to kill scores of police officers as this latest crop of right-wingers have. ",0,1269887835,,0,False,0,c0n4oea,t3_bjrwb,t1_c0n4oea,t1_c0n4jum,,1426258073,1,False,politics,t5_2cneq,1
True,binary_search_tree,,,"What is the AAPS?

""During the winter of 1943, the Lake County (Indiana) Medical Committee decided to take action against the Wagner-Murray-Dingell Bill, proposed legislation that would provide government health care for most U.S. citizens. Also opposed to the bill was the conservative National Physicians Committee. The committee began a membership drive in February 1944. By May 1944, the AAPS claimed members from all 48 states. In 1944, Time reported that the group's aim was the 'defeat of any Government group medicine.' In 1966, the New York Times described AAPS as an 'ultra-right-wing... political-economic rather than a medical group,' and noted that some of its leaders were members of the John Birch Society.

Positions:

""Though it describes itself as 'non-partisan', AAPS is generally recognized as politically conservative. According to Mother Jones, 'despite the lab coats and the official-sounding name, the docs of the AAPS are hardly part of mainstream medical society. Think Glenn Beck with an MD.'

""The organization opposes mandatory vaccination, universal health care and government intervention in healthcare. The AAPS has characterized the effects of the Social Security Act of 1965, which established Medicare and Medicaid, as 'evil' and 'immoral', and encouraged member physicians to boycott Medicare and Medicaid. AAPS argues that individuals should purchase medical care directly from doctors, and that there is no right to medical care. **The organization requires its members to sign a 'declaration of independence' pledging that they will not work with Medicare, Medicaid, or even private insurance companies.**[emphasis added]

""AAPS also opposes mandated evidence-based medicine and practice guidelines, criticizing them as a usurpation of physician autonomy and a fascist merger of state and corporate power where the biggest stakeholder is the pharmaceutical industry. Other procedures that AAPS opposes include abortion and over-the-counter access to emergency contraception. AAPS also opposes electronic medical records as well as any 'direct or de facto supervision or control over the practice of medicine by federal officers or employees.'

""On Oct 25 2008 the AAPS website published an editorial implying that Barack Obama was using Neuro-linguistic Programming, 'a covert form of hypnosis', in his presidential campaign.""

Source: http://en.wikipedia.org/wiki/Association_of_American_Physicians_and_Surgeons

*I know it's a wiki source, but there are numerous links to other sources on the wiki itself.*",0,1269984398,,0,True,0,c0n7dn1,t3_bk8tl,t1_c0n7dn1,t3_bk8tl,,1426259351,2,False,politics,t5_2cneq,2
True,rightwired,,,"In another stellar display of government efficiency, we find out today that more than 70 million vials of the H1N1 vaccine are going to be tossed into the desert, right next to the hundreds of millions of billions Atari 2600 ET cartridges.",0,1270141917,,0,False,0,c0nbl7s,t3_bl9yp,t1_c0nbl7s,t3_bl9yp,,1426261316,1,False,politics,t5_2cneq,1
True,ButterRun,,,"A ""market failure"" is a technical term that groups together abstract things like adverse selection, externalities, asymmetric information, moral hazard and perverse incentives.  Healthcare, unlike most markets, has examples of all of these things.

http://en.wikipedia.org/wiki/Market_failure

To be a quick study consider the following: insurance companies committing rescission, young healthy people not needing insurance while old sick people do, the fact that you benefit when your peers vaccinated against polio, and how do we deal with uninsured people in emergency situations, other than letting their bodies pile up outside the hospitals.

Now there are lots of interesting market oriented ways to solve these various failures but none of them are clear and easy.  We don't have the ability to spin a lightweight market oriented healthcare system overnight.  We simply don't have the collective economic IQ amongst the voting public or the lawmakers.  But we can move toward it bit by bit.  The state level insurance exchange moves in this direction as does the state innovation clause.  While things like the mandate and the ban on rejections for pre-existing conditions plugs some of the biggest holes in the current system.

As libertarians I think its important to choose your battles.  It might be fun to dream up a world with free market medicine, 100% private property, no centralized national defense and no environmental law.  But we should be focusing on low hanging fruit where we have a clear indisputable wins and less messy externalities, such as federalizing more power to the states, privatizing social security, ending the war on drugs, or removing trade and immigration barriers.
",0,1270187761,,0,False,0,c0ncs4h,t3_blfku,t1_c0ncs4h,t1_c0ncoum,,1426261872,6,False,politics,t5_2cneq,6
True,karmanaut,,,"&gt; Are there any examples of functioning Libertarian governments, either today, or at any time in history?

That would be a government that does only traditional functions: running a justice system, national defense, and international relations. Since Somalia has none of those, it isn't libertarian, it is just anarchy. As far as I know, there are no governments that have achieved pure libertarianism.

&gt; Ideologically, what's the difference between tax-supported army/police and other tax-supported services? Is the former just viewed as a necessary evil?

Well, think of it as ownership: society is better off when the government run by the people controls all forms of violence. If there were private actors capable of acting with force (private militias) then they could easily subvert the judicial system. Therefore, it is necessary that only the government exerts forceful control over society. However, having government run healthcare or something could be done by the private sector fairly.

Edit to answer your 3rd question: I don't think that would fall under the category of defense. Defense is ""defense from other people"", not from the forces of nature. By that definition, you could institute health and safety regulations (like the FDA) for the purposes of defense, or you could mandate vaccinations for the purposes of defense, etc. etc. Pure libertarians would argue that the changing environment is just a shift in supply and demand. Go into the boat business if the polar icecaps are melting.",0,1270308036,,0,False,0,c0nf5wr,t3_bm0mq,t1_c0nf5wr,t3_bm0mq,,1426263019,3,False,politics,t5_2cneq,3
True,interfect,,,"I'm not saying they always will help, or that there might not be some hypothetical situation in which it would be ""better"" for them to go against that duty. Maybe things would have turned out better if some doctor somewhere had never vaccinated Osama Bin Laden against Chicken Pox. But, yes, a doctor has an absolute duty to help. That's how duties work.",0,1270370379,,0,False,0,c0ngi51,t3_bm4b4,t1_c0ngi51,t1_c0nghfx,,1426263643,2,False,politics,t5_2cneq,2
True,DrDm,,,"Funny about that. We feed starving children. We hospitalize those same children, provide vaccinations and medical care. And yet we BITCH about increasing populations. And those children will NEVER find jobs as adults because their countries have ass fucks for politicians or dirt poor.

In the long run feeding today's starving children creates TOMORROW'S PROBLEMS.
",0,1270473491,,0,False,0,c0niips,t3_bmecp,t1_c0niips,t1_c0niafc,,1426264584,0,False,politics,t5_2cneq,0
True,harsesus,,,"No central government intervention into vaccination and female circumcision has everything to do with it.  The market is just a tool, as is the state.  Refusing to use one handicaps a nation.",0,1270602397,,0,False,0,c0nmdpg,t3_bn048,t1_c0nmdpg,t1_c0nmd1y,,1426266416,1,False,politics,t5_2cneq,1
True,[deleted],,,"Maybe you should read what you wrote.

&gt;No central government intervention into vaccination and female circumcision has everything to do with it. The market is just a tool, as is the state. Refusing to use one handicaps a nation.

Go on, back up your supposition. ",0,1270605479,,0,False,0,c0nmh8l,t3_bn048,t1_c0nmh8l,t1_c0nmgks,,1426266462,1,False,politics,t5_2cneq,1
