archived,author,author_flair_css_class,author_flair_text,body,controversiality,created_utc,distinguished,downs,edited,gilded,id,link_id,name,parent_id,removal_reason,retrieved_on,score,score_hidden,subreddit,subreddit_id,ups
True,Loggie,,,"&gt;That's a completely random and nonsensical statement. The entire point of judgement is comparing the positive to the negative. That's like saying we shouldn't judge someone who murders people because he's also productive.

Yeah, and I've refuted this already. This is a terrible analogy. A person isn't a tool; it has motives and makes decisions on its own. The internet is a tool, and as such should be judged on its usefulness as a whole, not its capability to do harm. 

&gt;It's used right now to promote: terrorism, creationism, anti-vaccination campaigns, anti-contraception campaigns, white supremacy, anti-semitism, racism in general, the denial of certain civil rights such as gay marriage (and they succeeded with prop 8); and it contains astronomical amounts of misinformation on any given subject. And it's dominated by the usual large interest groups: corporations and governments. A large portion of the news here comes from television networks. It's also used extensively to rob people.

Yeah, and it's also used promote pacifism, atheism, vaccination campaigns, anti-abstinence only education campaigns, destabilization of cultural divides, advocacy of minorities, support for rights, astronomical amounts of *correct* information on any given subject, and it's dominated by independent users. Sure it might have corporate owned websites, but who's responsible for filling it with content? Such as forums, youtube, instructables, aggregators, etc.

The people getting robbed, having their identities stolen, being trapped teenagers, making pipebombs, etc. are a minority. As far as white supremacy and extremism? People confirm their own biases.  I seriously doubt that an Atheist is going to go onto the internet to research religion and be convinced by the misinformation to switch to christianity. And any objective person, when reading misinformation, would immediately demand to see their sources. There are methods and systems in place for weeding out the bullshit and the negatives and yet you act like its on equal footing with everything else.",0,1280334103,,0,False,0,c0vehxc,t3_cu1k0,t1_c0vehxc,t1_c0vee09,,1426398862,1,False,politics,t5_2cneq,1
True,Achalemoipas,,,"&gt;Yeah, and I've refuted this already. This is a terrible analogy. A person isn't a tool; it has motives and makes decisions on its own. The internet is a tool, and as such should be judged on its usefulness as a whole, not its capability to do harm.

No, actually, you never said such a thing. Your response to this was that I was a troll. You're lying again.

And it's not a rebuttal to the argument, it's a rebuttal to the analogy. This is the argument:

""The entire point of judgement is comparing the positive to the negative.""

You're still pretending that the negative aspects don't count. And a human can be interpreted as a tool. Change human to employee, and conceptually, you have a tool. The analogy respects your logic perfectly. Replace it with a gun, a rock, a blade, a telephone, any random object and it still works.

Btw, you completely invalidate this argument yourself:

""it's dominated by independent users. Sure it might have corporate owned websites, but who's responsible for filling it with content? Such as forums, youtube, instructables, aggregators, etc.""

The internet doesn't do shit. You're using what persons do with a tool to argue the tool is a positive. And then pretend the analogy to what people do outside the internet doesn't work. The internet is just another environment. And it has been used to kill people, by other people:

http://abcnews.go.com/Health/cyber-bullying-factor-suicide-massachusetts-teen-irish-immigrant/story?id=9660938

&gt;Yeah, and it's also used promote pacifism, atheism, vaccination campaigns, anti-abstinence only education campaigns, destabilization of cultural divides, advocacy of minorities, support for rights, astronomical amounts of correct information on any given subject, and it's dominated by independent users. Sure it might have corporate owned website, but who's responsible for filling it with content? Such as forums, youtube, instructables, aggregators, etc.

""the existence of a good aspect doesn't negate the existence of bad aspects so your argument is completely irrelevant again.""

Do you think the rebuttals will somehow melt if you ignore them enough times?

&gt;The people getting robbed, having their identities stolen, being trapped teenagers, making pipebombs, etc. are a minority. As far as white supremacy and extremism? People confirm their own biases. I seriously doubt that an Atheist is going to go onto the internet to research religion and be convinced by the misinformation to switch to christianity. And any objective person, when reading misinformation, would immediately demand to see their sources. There are methods and systems in place for weeding out the bullshit and the negatives and yet you **act like its on equal footing with everything else**.

No, I don't. I said it was a tool that can be used for good or bad. 

All the arguments you make are about specific actions with a tool being good or bag. You actually never made an argument about the actual tool. 

That's like saying a rock is a positive because it's used to construct buildings. Constructing buildings is a positive. The rock is a fucking rock. 

It's an object. It can't be good or bad, positive or negative. Only what you do with it can be.

""It remains an information platform and it remains completely neutral since it's a tool that can be used both constructively and destructively.""

The fact that you personally perceive it as a mostly good influence on the world has absolutely no effect on the fact that it could be use ONLY for a bad influence on the world. Just like a fucking rock. 

And just for shits and giggles, how about you substantiate your statement. Demonstrate truth wins over falsehood on the internet. Then give a negative value to bullying people into suicide and traping children to rape and kill them, attribute a value to the good of the internet and compare. Quantify positive vs negative on the internet.

Try. It'll be fun. 


You purposely ""forgot"" to address the rest of the arguments. 

You'll have to respond to each before we can move on. 

Now, examine this. You pretended I offered no other negative than the spread of misinformation, when you read twice an entire paragraph containing a non exhaustive list of negatives.

This just happened. Are you still denying that you've created a delusion for yourself?

Because if you don't, the only other choices are stupid or liar.

Either you honestly misrepresented reality as a defense mechanism, or you actually fail to comprehend reality, making you stupid, or you do comprehend reality and purposely misrepresent it to dishonestly try to win an internet argument, making you a liar.

Which one is it?

You also tried to argue this was about net neutrality. Then you tried to misrpresent my argument as it being about the spread of information, instead of the internet.

You argued that the same argument was two different things it wasn't.

Do you at least realize this is the third time you say I didn't respond to something when I can quote the responses to those things, and that those responses were already stated twice? And you just ignored them?

How do you read something twice and then ""Believe"" it doesn't exist?




You're going to have to address each rebuttal before we can move on. I'm not going to let you weasel out of each rebuttal so that we have to repeat the same thing over and over, as you are doing now. 

Do you admit you lied about me never presenting negatives other than misinformation when you read them twice?

I dare you to defend your own words. For fuck's sake, man. Show some INTEGRITY. DEFEND YOUR OWN WORDS. It's the very least you can fucking do.",0,1280335272,,0,True,0,c0vejxf,t3_cu1k0,t1_c0vejxf,t1_c0vehxc,,1426398888,1,False,politics,t5_2cneq,1
True,M0b1u5,,,"#1: Very few people do not think the world is warming. This is because the world is currently in an ice age by the standards of the world. It would be highly unusual (if not impossible) for a world coming out of an ice age to not get warmer.

#2: getting warmer does NOT equate to ""getting worse"". In fact the warm periods during human history have corresponded to wealth, health and happiness.

#3: The ""Denialists"" as you brand them are not in fact denying anything. What they do NOT agree on, is that spending 100 Trillion dollars on things which may (or may not) be beneficial in 100 years is a good thing to do.

In point of fact, spending just 10% of the money the AGW idiots want to spend trying to be a Type I civilisation (about 100 years ahead of actually *being* a Type I) would secure the health and happiness of every single person on the planet *with 100% known outcomes*.

That 10 Trillion dollars would drop infant mortality world wide to 1st world country levels (and this has already been proved to reduce population growth to zero, or close to it. - Hans Rosling, TED 2010), provide clean drinking water to every single person on Earth, provide irrigation to another 10% of the world's surface, vaccinate all the people in the world and bunch of other stuff besides.

What Kyoto, and the AGW proponents want you to do is to pay corporations to do what they will do without being paid.

Carbon output per watt generated has decreased all by itself since the invention of fire - and not a single law was required to achieve this: lower carbon output = more efficient = more profitable. The numbers do not lie.

Oh, and look around you - does the world look destroyed? 

You are the very definition of a modern fucking idiot.",0,1280374252,,0,False,0,c0vgccm,t3_cuvmv,t1_c0vgccm,t3_cuvmv,,1426399732,1,False,politics,t5_2cneq,1
True,CharlesBarkley,,,"I think one's freedom rightly ends when their fist meets my face. The government ideally should exist to protect individuals from coercion. In the case of BP, the oil is a fist to our face, and the government should rightly hold the firm accountable.

Regarding pollution in general, I think we need good science to show harm, with a strong burden of proof. Most people have instinctually wrong ideas about science (the earth is 6000 years old, irradiation is satan's work, vaccines cause autism, etc.). Public opinion regarding harmfulness is not sufficient. There has to be high quality epidemiological work to show harm.

In terms of BP, the burden of proof is fucking obvious. Regarding some other causes celebres of the environmental movement, I'm not fucking convinced.",0,1280380343,,0,False,0,c0vgkap,t3_cuvpd,t1_c0vgkap,t1_c0vgjj1,,1426399834,2,False,politics,t5_2cneq,2
True,Berlet98,,,"Making ethical judgments is a complex business, fraught with nuances and subjectivity.

Ethics has been defined as “the study and evaluation of human conduct in the light of moral principles. . . the standard of conduct that individuals have constructed for themselves or as the body of obligations and duties that a particular society requires of its members. Ethics has developed as people have reflected on the intentions and consequences of their acts.”

That definition may be reduced to four words, doing the right thing.

There’s a narrow distinction between unethical behavior and simply lying although some form of lying is usually associated with a lack of ethics.  

Thus, when Elena Kagan dissembled in her testimony before the Senate Judiciary Committee by saying she had merely “suggested” changes in the language of an anti-partial birth document to which she objected she was both lying and acting unethically to accomplish her goals: http://tiny.cc/9l5jb

On the other hand, when President Obama appeared on “The View” today and listed dealing with the H1N1 “pandemic” as one of the “thorns” of his first 18 months in office he was dramatizing, bloviating, in a word, lying. There was no H1N1 pandemic in 2009 as he well knew.  It was no more a pandemic than the average year’s flu.  The Center for Disease Control had grossly exaggerated the H1N1 virus danger and the manufacturers of the Swine Flu vaccine reaped a windfall in the billions.

Much more clearcut as unethical behavior were the actions of United States congressman Rep. Charles Rangel and Pfc. Bradley Manning of the 10th Mountain Division Second Brigade in Baghdad. . .",0,1280468629,,0,False,0,c0vjv3r,t3_cvddi,t1_c0vjv3r,t3_cvddi,,1426401389,1,False,politics,t5_2cneq,1
True,AdoptASato,,,"Thanks Tony Robbins.

This is the same sort of thinking - weighing isolated anecdotes of massive success more than actual data about who gets rich and how often - behind vaccine denial.

I don't mean you should give up, but trying to get rich is, statistically speaking, doomed to fail in the overwhelming majority of cases.  

This aspirational fallacy leads to some pretty counter-productive things.  many Americans say, in effect, ""don't tax the rich, I'll be rich someday!""  But really, they probably won't.",0,1280514606,,0,False,0,c0vlc75,t3_csygo,t1_c0vlc75,t1_c0vjezo,,1426402077,1,False,politics,t5_2cneq,1
True,powercow,,,"Free market sucks, I would rather a healthy market which means their are strong regulations to ensure that competition can enter the market just as easily as those before them.

we spend nearly 1 trillion a year on defence, more than the next ten countries combined. BTW health care will costs about 1 trillion over ten. we could send men to mars for 1 trillion.

less restrictive gun laws? how much less restrictive do you need them? we have holes in our background check laws big enough for a terrorists to fly a plane through. We have some of the weakest gun laws on the planet.

WElfare was reformed in 96, you get a total of 6 years for life. You go on welfare today for 4 years, that means you have 2 years of safety net when you are 60. a clear majority of people on welfare stay on for only one year. This is so an east shit republican meme that really must die. Welfare was reformed. There are less people on welfare. AND YEAH A FUCKING DEMOCRACT REFORMED HEALTHCARE CAUSE WHILE THE GOP TALK A BIG GAME, THEY NEVER ACT LIKE FUCKING LEADERS.

So you believe in small government for everything but abortion.


Yeha I get your a libertarian, but you will grow out of it one day. Our rural america, you know the people that feed us, wouldnt have electricity, roads, phone service, without the government. We also wouldnt have many vaccines without the government. These are things that we all need, but they are not profitable.

",0,1280931126,,0,False,0,c0vxxk5,t3_cx9zm,t1_c0vxxk5,t3_cx9zm,,1426407988,2,False,politics,t5_2cneq,2
True,[deleted],,,"Yeah, I haven't really taking them seriously since they started giving a voice to anti-vaccine nutjobs and other various crazies. I do like a few individual writers, though",0,1281039784,,0,False,0,c0w28eq,t3_cxofg,t1_c0w28eq,t1_c0w1oip,,1426410009,2,False,politics,t5_2cneq,2
True,wesharedthecouch,,,"FUCK the children.  Why should I pay for someone else's shitty snot-nosed brats to get over-vaccinated, fed ADD medication, and go to the doctor every time little Jr. BibleBelt Sonofabitch has the fucking sniffles?  I chose not to have children so that shit wouldn't be my problem.  Did I ask you to pay for my abortion?  No.  So fuck off.  

COME ON DOWNVOTES!  ",0,1281043844,,0,False,0,c0w2gno,t3_cw2dg,t1_c0w2gno,t1_c0vq7m9,,1426410116,1,False,politics,t5_2cneq,1
True,BraveSirRobin,,,"&gt; When a guy loses his own home town in the election.... something no poll predicted.... and didn't just loose it, but lost it in a landslide

All of the points you raised are covered in the first page or so of the linked article. The fact that you suggested the ""more people than live there"" point shows you've made no effort to even read it and that you only have a superficial ""knowledge"" of what happened. This is *normal* in Iran, people move to cooler parts of the country in summer and you can vote anywhere in the country. Overall turnout was consistent with a census a few years before, having grown *exactly* as was expected due to the population growth rate. 

As I said, *every single* suggestion of fraud is covered in depth in the linked article. Statistical analysis has shown no fraud took place. Polls did not say anything that you suggest. Mousavi won his home region (Shabestar). Everything you know about it from the regular media is a lie, just as they did in 2002 WRT to Iraq. 

&gt; that seems to be your contention here?

No, my contention is that most people are extremely suggestible and unable to look things up for themselves. Feel free to continue to believe it was fraudulent, just be aware that you are very wrong. You are no different than those who believed that Iraq had WMD and that autism is caused by vaccinations. I'm not trying to be rude, just hinting that not believing everything you are told &amp; a little bit of independent research might not hurt. 

&gt; if that is what it was considering it was two factions in the same government each vying for power

So is almost every single coup on the planet. When you send your own guys in it's normally called ""warfare"". This point has no relevance.

&gt; I repeat, the Iranian government hates Mosaddegh and everything he ever stood for. 

So. What? Do you have a point there? I fail to see how that justifies the coup to replace him with a regime that has been singled out as one of the most repressive in human history. The attitudes of any government ever, lets alone the present one, to either party in that situation are completely irrelevant with the morality of the decision and the outcome. 

&gt; They spent at least 8 times the amount of money on the two little wars than they even dreamed of earning back. 

Who's ""they""? Neither Cheney or Bush are out of pocket here. Not in the slightest. 

&gt; You are claiming they went down to the liquor store and spent $1 million on lotto tickets in the hopes of winning the $100,000 jackpot. 

No, I'm saying that [since 1997](http://www.newamericancentury.org/iraqmiddleeast2000-1997.htm) they've been planning a series of conflicts to further promote US strategic control of the worlds oil reserves and that in the process they transferred vast quantities of money from the tax payers and the increase of national debt directly into the pockets of those who financed their original campaigns. 

Billions upon billions are completely unaccounted for. Vastly more money has been ""legitimately"" siphoned off in the war industry. For four years the Iraq oil wasn't even being metered, the oil industry just helped itself. The money made of this war is not even comprehendable.

The only people that are at a loss are the American people who will be paying for this armed robbery for generations. 

&gt; it is because they were stupid.

No, it is most of the population that are stupid to [not notice the obvious](http://en.wikipedia.org/wiki/Pnac#Associations_with_Bush_administration). When a think speaks [loudly and clearly](http://www.newamericancentury.org/iraqmiddleeast2000-1997.htm) about it's intentions and follows through when it completely takes over the whitehouse, you have to be pretty dumb yourself to think stupidity was their driver. ",0,1281053313,,0,False,0,c0w2wsj,t3_cxofg,t1_c0w2wsj,t1_c0w2rj3,,1426410325,0,False,politics,t5_2cneq,0
True,Seagull66,,,"But I'm forced to pay a huge percent of my salary for a war I don't want because I don't have tax shelters and capital gains rates and these guys get to ""[do] more good"" because they cheat. I want to do more good, too, but I'd rather put my money into a common pool to help create a more just society.

Look, I don't mean to take away from someone who wants to give to charity. Gates is a hero of mine because of his vaccination programs. He has saved hundreds of thousands of lives (at least). What a great way to use his money. But infant mortality rates in the U.S., for example, are far too high for a modern nation. This is a society-wide problem that requires a social solution. 

I just think that the emperor has always bought the mob bread when he wants them to calm down and ignore the other horrible things he's doing. I don't want any bread. I want them to stop doing horrible things. I just can't get over the feeling that we're being played on a regular basis. It's horribly complicated issue (charity vs. social intervention) that we can't solve in a few soundbites. I just want to throw in some healthy skepticism.",0,1281109493,,0,False,0,c0w4pdx,t3_cxcg5,t1_c0w4pdx,t1_c0w11q8,,1426411162,1,False,politics,t5_2cneq,1
True,macwithoutfries,,,"Well, assuming you are bitten by a rabid animal you could:

- pray for help from your god;

- ""let's wait and see if it happens"" ;

- get the vaccine.

Knowing that for the entire human history until 2005 there were precisely zero non-vaccinated survivors (and that since then there have been like 5 using a protocol that costs like 10000 times more than the vaccine yet still leaves a percentage of the survivors with brain damage) - which one would you choose ?",0,1281334963,,0,False,0,c0wbm9p,t3_cyr5p,t1_c0wbm9p,t1_c0wat9d,,1426414411,1,False,politics,t5_2cneq,1
True,TooSmugToFail,,,"You are absolutely right. You can't expect to win over Beck-heads. But the key here is to win over those that haven't made their minds yet. 

Key is in showing the indifferent people how low, dirty and vile these guys are in their unscrupulous propaganda. 

Sure, Beck is specifically targeting a fringe demographic stupid enough to buy his crap. But if he keeps saturating this space with these ideas and concepts, some of them will inevitably seep out of his demographic and into the general public. 

We are generally lazy and often tend to adopt ideas and concepts not at their face value, but within a frame of a social proof: if other people believe in it, then it must be true. 

You would be right to say that clever people wouldn't buy into that crap, and you would be 100% right. Clever people wouldn't, but average people? The central part of the Gauss curve, the bulk of the population, will usually sway with what it believes is the sentiment of the majority. You just need to reach the tipping point.

And that's how the propaganda works: first the stupid extremists, because they are most likely to accept the propaganda at its face value (because they are, well, stupid) and once the tipping point is reached, everyone else will follow.

The goal of any anti-Beck counter-campaign would be to 'vaccine' the average Joe against those ideas by setting the frame in which he will perceive those ideas when they hit him. 

What do I mean by settign the frame? For example, when he's exposed to those ideas, you want him to go ""hey, isn't that the guy that's conning stupid and old people out of their money?"" instead of ""hey, he may be right, that black dude does remind me of Lucifer..."" 

I mean, I'm obviously being absurd here, but you get the picture...

",0,1281344796,,0,False,0,c0wbu2s,t3_cxwf6,t1_c0wbu2s,t1_c0w820i,,1426414512,2,False,politics,t5_2cneq,2
True,aolley,,,vaccine stock already high,0,1281459095,,0,False,0,c0wflu8,t3_czkf7,t1_c0wflu8,t3_czkf7,,1426416272,1,False,politics,t5_2cneq,1
